{"adoption_profile_id":"sedb-v0.4b-adoption","adoption_profile_version":"1","adoption_status":"adopted","archive":{"filename":"SEDB-v0.4B-local.zip","sha256":"159F0928415811A434E885D50E94846266474725723D25DAC426170874B844D8","size":8980052},"compatibility_status":"compatible","ctcl":{"instant_id":"ctcl:instant:46d7dd15-2315-4d1d-ba8b-4d6de62f1887","register_response":{"encodings":{"rfc3339":"2026-08-23T19:26:03.145Z","unix_ms":"1787513163145","unix_ns":"1787513163145000000","unix_s":"1787513163.145","unix_us":"1787513163145000"},"from_wall_clock":true,"id":"ctcl:instant:46d7dd15-2315-4d1d-ba8b-4d6de62f1887","label":"SEDB-RAL Basic Phase 2 final validation","meta":{"archive_sha256":"159F0928415811A434E885D50E94846266474725723D25DAC426170874B844D8","git_head":"419c78428e05f99659e4df9862f8eda734fd6374","github_push":false,"phase":"Basic Phase 2 final validation","speaker_label":"織域","technical_gate_passed":true},"reference_timescale":"utc","registered_at":"2026-08-23T19:26:03.145Z","retrieve":"/v1/instant/ctcl:instant:46d7dd15-2315-4d1d-ba8b-4d6de62f1887","share":"https://commoninstant.org/i/46d7dd15-2315-4d1d-ba8b-4d6de62f1887","signature":{"alg":"Ed25519","key_id":"ctcl-ed25519-1","signed_fields":"instant_id|unix_ns|timescale","value":"cOhg4nwmbF6iNekZqRoGSIj+tcQ/7Q+H3FY1G713kaCp2by8fD6SPlzTWTuFBhclvEDKLUe+XeXbss+G6MhHAQ==","verify":"/v1/pubkey"},"timescales":{"gps_approx":"1787513181.145","posix":"1787513163.145","tai_approx":"1787513200.145","utc":"2026-08-23T19:26:03.145Z"},"unix_ns":"1787513163145000000"},"retrieve_response":{"encodings":{"rfc3339":"2026-08-23T19:26:03.145Z","unix_ms":"1787513163145","unix_ns":"1787513163145000000","unix_s":"1787513163.145","unix_us":"1787513163145000"},"from_wall_clock":true,"id":"ctcl:instant:46d7dd15-2315-4d1d-ba8b-4d6de62f1887","label":"SEDB-RAL Basic Phase 2 final validation","meta":{"archive_sha256":"159F0928415811A434E885D50E94846266474725723D25DAC426170874B844D8","git_head":"419c78428e05f99659e4df9862f8eda734fd6374","github_push":false,"phase":"Basic Phase 2 final validation","speaker_label":"織域","technical_gate_passed":true},"reference_timescale":"utc","registered_at":"2026-08-23T19:26:03.145Z","signature":{"alg":"Ed25519","key_id":"ctcl-ed25519-1","signed_fields":"instant_id|unix_ns|timescale","value":"cOhg4nwmbF6iNekZqRoGSIj+tcQ/7Q+H3FY1G713kaCp2by8fD6SPlzTWTuFBhclvEDKLUe+XeXbss+G6MhHAQ==","verify":"/v1/pubkey"},"timescales":{"gps_approx":"1787513181.145","posix":"1787513163.145","tai_approx":"1787513200.145","utc":"2026-08-23T19:26:03.145Z"},"unix_ns":"1787513163145000000"},"state":"finalized"},"differential":{"counts":{"contradiction":0,"expected_by_mapping":0,"unmapped":0},"differences":[],"passed":true},"error_codes":[],"evidence_refs":["profiles/sedb-v0.4b-adoption.json","profiles/sedb-v0.4b-mapping.json","scripts/validate_sedb_v04b.py",".superpowers/sdd/2026-08-23-basic-phase-2-sedb-profile/task-5-report.md"],"executed_controls":[{"executed":true,"expected_code":"archive_hash_mismatch","injected_change":"replace the pinned archive SHA-256 with sixty-four zeroes","name":"archive_hash","observed_code":"archive_hash_mismatch"},{"executed":true,"expected_code":"manifest_hash_mismatch","injected_change":"replace one internal MANIFEST.sha256 digest with sixty-four zeroes","name":"manifest","observed_code":"manifest_hash_mismatch"},{"executed":true,"expected_code":"mapped_value_contradiction","injected_change":"replace the exported mapped ral.resident_id value","name":"mapping_contradiction","observed_code":"mapped_value_contradiction"},{"executed":true,"expected_code":"null_vs_false_contradiction","injected_change":"replace a mapped JSON null with boolean false","name":"null_vs_false","observed_code":"null_vs_false_contradiction"},{"executed":true,"expected_code":"forbidden_call:socket.create_connection","injected_change":"inject a socket.create_connection call into a temporary package","name":"no_send","observed_code":"forbidden_call:socket.create_connection"}],"integration":{"cell_count":7,"database_integrity":"ok","entity_count":1,"expected_record_count":1,"exported_record_count":1,"field_count":8,"normalized_export_digest":"sha256:sedb-ral-json-nfc-codepoint-v1:b55c83085c8c5d55a0735c479387d28bb08b7ae630610dd4ad80b9f54dee61e2","raw_export_sha256":"fc8e77dac6c15471b27dfd3e70ac533137a234ed8fa3330aa9d027d2c52e24eb","records_match":true},"manifest":{"expected_entry_count":114,"observed_entry_count":114,"path":"MANIFEST.sha256","verified":true},"mapping_profile_digest":"sha256:sedb-ral-json-nfc-codepoint-v1:07d67d5135b97ba8a9521e3f6c33a6897e64ec65422a02cabea6cb0c398d9ef5","mapping_profile_id":"sedb-v0.4b-mapping","mapping_profile_version":"1","package":{"name":"sedb-local","source_commit":"139b9952bb283b2e95f7690d76e3c5fbcdc680aa","version":"0.4.0b1"},"passed":true,"phase1":{"phase1a":{"checked_fixtures":["fixtures/ctcl/reading.json","fixtures/ctcl/registered-anchor.json","fixtures/identifier/mixed_population/manifest.json","fixtures/identifier/mixed_population/one-resident.json","fixtures/identifier/negative/shared-runtime-tag.json","fixtures/identifier/positive/resident-address.json","fixtures/ledger/event-001.json","fixtures/ledger/event-002.json"],"checked_schemas":["ctcl-receipt.schema.json","identifier-discrimination.schema.json","identifier-field.schema.json","ledger-event.schema.json"],"error_codes":[],"ledger_status":"checkpoint_verified","observed_decisions":["admit","indeterminate","reject"],"passed":true},"phase1bc":{"delivery_stage":"instance_acknowledged","error_codes":[],"executed_faults":[{"executed":true,"expected_red_code":"negative_fixture_missing","observed_red_code":"negative_fixture_missing","test_name":"phase1a_missing_negative_fixture"},{"executed":true,"expected_red_code":"required_artifact_missing:src/sedb_ral/schemas/transcript-binding.schema.json","observed_red_code":"required_artifact_missing:src/sedb_ral/schemas/transcript-binding.schema.json","test_name":"required_transcript_schema_missing"},{"executed":true,"expected_red_code":"application_claim_subject_mismatch","observed_red_code":"application_claim_subject_mismatch","test_name":"admission_cross_resident"},{"executed":true,"expected_red_code":"correction_target_event_mismatch","observed_red_code":"correction_target_event_mismatch","test_name":"projection_wrong_correction_target"},{"executed":true,"expected_red_code":"scope_overlap_missing","observed_red_code":"scope_overlap_missing","test_name":"claim_explanation_scope_mismatch"},{"executed":true,"expected_red_code":"speaker_resolution_indeterminate","observed_red_code":"speaker_resolution_indeterminate","test_name":"transcript_unbound_turn"},{"executed":true,"expected_red_code":"schema_invalid","observed_red_code":"schema_invalid","test_name":"adapter_matrix_invalid_submit"},{"executed":true,"expected_red_code":"sqlite_projection_mismatch","observed_red_code":"sqlite_projection_mismatch","test_name":"sqlite_projection_mutation"},{"executed":true,"expected_red_code":"package_root_missing","observed_red_code":"package_root_missing","test_name":"no_send_package_missing"},{"executed":true,"expected_red_code":"forbidden_call:socket.create_connection","observed_red_code":"forbidden_call:socket.create_connection","test_name":"no_send_socket_call"},{"executed":true,"expected_red_code":"forbidden_import:sedb","observed_red_code":"forbidden_import:sedb","test_name":"no_send_sedb_import"}],"executed_positive_controls":[{"executed":true,"expected_red_code":"positive","observed_red_code":"positive","test_name":"admission_positive"},{"executed":true,"expected_red_code":"positive","observed_red_code":"positive","test_name":"projection_correction_positive"},{"executed":true,"expected_red_code":"positive","observed_red_code":"positive","test_name":"claim_explanation_positive"},{"executed":true,"expected_red_code":"positive","observed_red_code":"positive","test_name":"transcript_binding_positive"},{"executed":true,"expected_red_code":"positive","observed_red_code":"positive","test_name":"adapter_matrix_delivery_positive"},{"executed":true,"expected_red_code":"positive","observed_red_code":"positive","test_name":"sqlite_projection_positive"},{"executed":true,"expected_red_code":"positive","observed_red_code":"positive","test_name":"no_send_positive"}],"incident_count":29,"incident_sha256":"9a4a504621d6837b0724cbfebc7a9db84a5f260103d9ce585a3087a39a6a3828","no_send_findings":[],"passed":true,"phase1a_passed":true,"required_artifact_count":82,"sqlite_bytes_identical":true,"sqlite_row_counts":{"addresses":0,"applications":1,"attestations":0,"bindings":1,"claims":1,"deliveries":0,"projection_meta":4,"residents":1}},"projection_head":"evt_resident_registered_9e5cd5acec119d11"},"receipt_id":"sha256:sedb-ral-json-nfc-codepoint-v1:74449966add4d981a9df631945ce6b95399fbfa1c89d4375500cae4223bd37da","schema_version":"0.2","sedb_tests":{"own_execution":{"failed":0,"fresh_execution":false,"inherited_from":".superpowers/sdd/2026-08-23-basic-phase-2-sedb-profile/task-5-report.md","passed":189,"skipped":0},"package_claim":null,"selected_source":"own_execution"},"signature_presence":"not_performed"}
